,headline,author,leadparagraph,publication date,keywords
0,Review: Tesla Quartet Captures Playful Charms of Caroline Shaw,,"Near the end of Caroline Shaw’s “Entr’acte” (2011), a halting, Haydnesque minuet and trio for string quartet, Ms. Shaw asks the musicians to play notes that seem to fall away — to make a sound, as she writes in the score, “like a little sigh.”",2015-12-07 21:25:12+00:00,"['Music', 'Shaw, Caroline', 'New School', 'Classical Music', 'Tesla Quartet']"
1,Boston Consulting’s Most Innovative Companies: Lessons From a Decade of Ranking,Bits,"Innovation is an essential yet elusive ingredient in corporate success, and one that is notoriously difficult to measure.",2015-12-02 05:01:18+00:00,"['Innovation', 'Apple Inc', 'Boston Consulting Group', 'Google Inc', 'Tesla Motors Inc', 'China']"
2,A Car Dealers Won’t Sell: It’s Electric,,"More than seven years ago, President Obama called for one million electric cars to be on the road by this year, and the vehicles have gained a large fan club. Environmentalists promote them as a smart way to cut dangerous emissions. Owners love their pep and the gas money they save. Apple and Google have jumped into the race to build next-generation battery-powered cars.",2015-11-24 16:23:10+00:00,"['Electric and Hybrid Vehicles', 'Greenhouse Gas Emissions', 'Global Warming', 'Automobiles', 'Fuel Efficiency', 'Fuel Emissions (Transportation)', 'Energy Efficiency', 'J D Power & Associates', 'Consumer Reports', 'Tesla Motors Inc', 'Nissan Motor Co', 'National Automobile Dealers Assn', 'New York State', 'California']"
3,"Elon Musk Says Never Mind the Hiccups, Tesla Is on Track",,"Tesla Motors on Tuesday sought to reassure investors and its devoted fans that it was still on track to produce more than 50,000 cars this year, though the electric-car company hinted at some production issues with its new Model X sport utility vehicle.",2015-11-04 00:40:18+00:00,"['Tesla Motors Inc', 'Musk, Elon', 'Electric and Hybrid Vehicles', 'Automobiles']"
4,Morning Agenda: Activision Blizzard to Buy Maker of Candy Crush,News,"ACTIVISION BLIZZARD TO BUY MAKER OF CANDY CRUSH  | One of the biggest names in traditional video games is taking its boldest step into mobile gaming. Activision Blizzard plans to buy King Digital Entertainment, the maker of Candy Crush Saga, for about $5.9 billion,Michael J. de la Merced and Nick Wingfield report in DealBook.",2015-11-03 10:52:23+00:00,"['Antitrust Laws and Competition Issues', 'Christians and Christianity', 'Computer and Video Games', 'First Amendment (US Constitution)', 'Freedom of Religion', 'Initial Public Offerings', 'Religion and Belief', 'Activision Blizzard Inc', 'Alphabet Inc', 'Amsurg Corporation', 'CBS Corporation', 'Church of Scientology', 'Citadel Investment Group', 'ConAgra Foods Inc', 'European Central Bank', 'European Union', 'Google Inc', 'Janus Capital Group Inc', 'King Digital Entertainment PLC', 'Molson Coors Brewing Company', 'Roman Catholic Church', 'Shire PLC', 'Standard Chartered Bank PLC', 'Tesla Motors Inc', 'UBS AG', 'Valeant Pharmaceuticals International Inc', 'Visa Inc', 'Volkswagen AG']"
5,Consumer Reports Stops Recommending the Tesla ,,"Consumer Reports dropped its recommendation of the Tesla Model S after owners of the electric luxury sedan complained of a series of problems including squeaking noises, motors that needed to be changed and issues with the car’s automatic door handles.",2015-10-20 23:18:36+00:00,"['Tesla Motors Inc', 'Consumer Reports', 'Automobile Safety Features and Defects']"
6,"Car Repairs a Click Away, Without the Fuss and Bother",Wheels,VINCE VANNELLI’S flat tire came at a bad time — just as he was on his way to the San Francisco airport for a flight to Los Angeles.,2015-10-29 16:44:07+00:00,"['Automobiles', 'Automobile Service and Charging Stations', 'Lexus Division of Toyota Motor Corp', 'Ford Motor Co', 'Tesla Motors Inc', 'Service Marketplace Inc (YourMechanic)']"
7,Tesla Adds High-Speed Autonomous Driving to Its Bag of Tricks,Wheels,WASHINGTON — It is not every day you get to open a door and step into the future.,2015-10-15 20:02:35+00:00,"['Tesla Motors Inc', 'Kessler, Aaron M', 'Driverless and Semiautonomous Vehicles', 'Automobiles']"
8,Norway Is a Model for Encouraging Electric Car Sales,,"OSLO — Berit Nordgarden and her husband, Eivind Tellefsen, loved their nonpolluting Nissan Leaf electric car. But they found its 85-mile battery life too short for weekend trips to their cottage with their two young children.",2015-10-16 09:00:06+00:00,"['Norway', 'Electric and Hybrid Vehicles', 'Volkswagen AG', 'Fuel Emissions (Transportation)', 'Diesel Power', 'Air Pollution', 'Automobiles', 'Tesla Motors Inc', 'Norwegian University of Science and Technology', 'University of Minnesota', 'Europe']"
9,"Hands-Free, on the Highway",,"The driver who tested the Tesla Model S with the new autopilot feature was nervous at first, but soon learned to let the computer drive the car.",2015-10-15 20:03:35+00:00,"['Tesla Motors Inc', 'Automobiles', 'Science and Technology', 'Driverless and Semiautonomous Vehicles']"
10,"Tesla Delivers Model X, Its First Sport Utility Vehicle",,"Tesla Motors is delivering its first sport utility vehicles, adding a second model to its lineup as it seeks to attract more buyers to its electric vehicles.",2015-09-30 14:03:56+00:00,"['Tesla Motors Inc', 'Electric and Hybrid Vehicles', 'Sports Utility Vehicles and Light Trucks', 'Musk, Elon']"
11,What We’re Reading,News,"Get recommendations from New York Times reporters and editors, highlighting great stories from around the web. What We’re Reading emails are sent twice a week. Sign up »",2015-10-09 20:37:09+00:00,"['Driverless and Semiautonomous Vehicles', 'Gun Control', ""Dell'Antonia, Karin J"", 'Fiorina, Carleton S', 'Hardy, Quentin', 'Jobs, Steven P', 'Richardson, Lynda', 'Huffington Post', 'Tesla Motors Inc']"
12,"Data on Spending, Trevor Noah Starts and Tesla Unveils an S.U.V.",The Week Ahead,"On Monday morning, the Commerce Department will report the latest data on consumer spending and personal income in August. Wall Street is looking for healthy gains for consumers, with income up 0.4 percent and consumption rising 0.3 percent.",2015-09-28 00:00:43+00:00,"['United States Economy', 'Economic Conditions and Trends', 'Tesla Motors Inc', 'Noah, Trevor (1984- )', 'Real Estate and Housing (Residential)', 'Puerto Rico', 'Bank of America Corporation', 'Uber Technologies Inc', 'Volkswagen AG', 'China', 'Labor and Jobs']"
13,"Porsche, Aiming at Tesla, Unveils Electric Concept Car",,"Ever since Tesla’s Model S went on sale in 2012, the start-up automaker has had the market for high-end electric cars to itself. But that is changing as other automakers start to introduce their own models.",2015-09-15 01:28:42+00:00,"['Porsche AG', 'Electric and Hybrid Vehicles', 'Automobiles', 'Tesla Motors Inc']"
14,The Tesla Cheerleader,Op-Ed Columnist,Do you remember when Henry Blodget first became famous?,2015-08-29 02:24:05+00:00,"['Morgan Stanley', 'Tesla Motors Inc', 'Jonas, Adam M (1974- )', 'Musk, Elon', 'Blodget, Henry', 'Amazon.com Inc', 'Automobiles']"
15,Consumer Reports Gives New Tesla Its Highest Score Ever,,"Consumer Reports gave the Tesla Model S P85D sedan its highest score ever for a car, breaking the magazine’s scoring system by initially giving it 103 out of 100. Editors were forced to adjust the scoring system, leaving the electric car with a mere 100 out of 100.",2015-08-28 02:37:19+00:00,"['Automobiles', 'Tesla Motors Inc', 'Electric and Hybrid Vehicles', 'Consumer Reports']"
16,Tesla Stations at Airbnb Locations,In Transit,"Airbnb and Tesla Motors are starting a partnership to bring Tesla car charging stations to 30 Airbnb properties along the West Coast in cities such as Los Angeles, Palm Springs and Healdsburg, Calif. Tesla has donated and installed the stations that are meant to give travelers freedom on their road trips, according to Chip Conley, head of global hospitality and strategy at Airbnb. “When considering accommodations, Tesla drivers are limited by how far they can get on their car’s battery charge, but this partnership alleviates that constraint,” he said.",2015-08-20 17:27:43+00:00,"['Travel and Vacations', 'Airbnb', 'Tesla Motors Inc']"
17,Morning Agenda: David Einhorn Surveys Investors,News,"DAVID EINHORN SURVEYS INVESTORS | David Einhorn has a reputation as one of the savviest stock pickers on Wall Street, but even he has not been spared in the recent market turmoil. This year is shaping up to be one of the worst in the history of his hedge fund. People briefed on the matter say the Greenlight Capital fund was down 5.3 percent in August and down 14 percent for the year. And Mr. Einhorn has been trying to find out what his investors think about the fund, Alexandra Stevenson and Matthew Goldstein report in DealBook.",2015-09-01 11:15:25+00:00,"['Banking and Financial Institutions', 'Bitcoin (Currency)', 'CHINA', 'Copper, Brass and Bronze', 'Hedge Funds', 'Popes', 'Stocks and Bonds', 'Moynihan, Brian T', 'Thiel, Peter A', 'ARGENTINA', 'AstraZeneca PLC', 'Bank of America Corporation', 'Bank of New York Mellon Corporation', 'MERGERS, ACQUISITIONS AND DIVESTITURES', 'RadioShack Corporation', 'Securities and Exchange Commission', 'Tesla Motors Inc', 'Valeant Pharmaceuticals International Inc', 'Whirlpool Corporation', 'Silicon Valley (Calif)']"
18,"Betting on a Smooth Ride, Investors Flock to Tesla ",,"Tesla Motors has seemingly defied the law of financial gravity on Wall Street ever since the company began proving that electric cars could be sporty, powerful and trendy — not just green.",2015-08-15 00:55:18+00:00,"['Kessler, Aaron M', 'Tesla Motors Inc', 'Electric and Hybrid Vehicles', 'Musk, Elon', 'Stocks and Bonds']"
19,Tesla Drivers Will Soon Find More Charging Stations in Manhattan,,Manhattan’s dense urban landscape should in theory be a perfect environment for electric cars. The stop-and-go-traffic and shorter distances most drivers travel are ideal for an electric-powered motor.,2015-08-13 04:48:47+00:00,"['Tesla Motors Inc', 'Kessler, Aaron M', 'Manhattan (NYC)', 'Electric and Hybrid Vehicles']"
20,"Tesla Motors Trims Delivery Outlook, Sending Stock Down",,"Even as Tesla Motors painted a better-than-expected financial picture in announcing its second-quarter earnings on Wednesday, it warned of fewer car deliveries for the year, sending the stock tumbling.",2015-08-05 21:59:45+00:00,"['Tesla Motors Inc', 'Kessler, Aaron M', 'Electric and Hybrid Vehicles', 'Company Reports', 'Musk, Elon']"
21,"Greece’s Market Reopens, European Banks Report Results, and Tesla Announces Earnings",The Week Ahead,"The Athens Stock Exchange reopened on Monday after a five-week closure that followed a decision by the Greek authorities to shut Greek banks and impose capital controls. The banks reopened two weeks ago, though restrictions on cash transactions remain in place to avert a run on the banks’ deposits. To prevent capital flight, a mass sell-off of holdings and a market crash, there is a cap on stock fluctuations and restrictions on local traders, though foreign investors will face no constraints when stock trading resumes. The reopening of Greece’s market comes as government officials and representatives of the country’s international creditors enter a second week of difficult negotiations on a multibillion-euro bailout, Greece’s third in five years. —Niki Kitsantonis",2015-08-03 02:17:48+00:00,"['Greece', 'Automobiles', 'Company Reports', 'International Trade and World Market', 'Stocks and Bonds', 'Labor and Jobs', 'Axis Capital Holdings Ltd', 'Partnerre Ltd', 'Mergers, Acquisitions and Divestitures', 'Tesla Motors Inc', 'European Sovereign Debt Crisis (2010- )']"
22,Urban Explorers Journey Into the Ruins of Long Island,Arts | Long Island,"Winter had been particularly rough. The sound of sparrows singing, hidden within the vines and bramble, provided the perfect backdrop for exploration.",2015-07-24 02:54:50+00:00,"['Long Island (NY)', 'Buildings (Structures)', 'Photography', 'Social Media', 'Historic Buildings and Sites', 'Tesla Science Center at Wardenclyffe', 'Kings Park Psychiatric Center', 'Exploration and Explorers']"
23,Tesla’s Home Battery System,,"On CNBC, Phil LeBeau reports on Elon Musk’s introduction of battery systems for home and business use.",2015-05-01 13:13:34+00:00,"['Tesla Motors Inc', 'Batteries', 'Alternative and Renewable Energy']"
24,Tesla's cash burn,,"Tesla is losing more than $4,000 on every Model S electric sedan it sells, and is burning cash, despite a bull market for luxury vehicles. Bobbi Rebell reports.",2015-08-10 18:51:41+00:00,[]
25,Tesla's stock vrooms,,Tesla's bullish production outlook drives stock higher. Fred Katayama reports.,2015-11-04 19:26:10+00:00,[]
26,Tesla: the new Uber?,,"Shares in electric car maker Tesla continue to climb after Morgan Stanley predicted its stock will nearly double in the next 12 months. But as Ivor Bennett reports, the sector still faces plenty of challenges.",2015-08-19 16:31:40+00:00,[]
27,Tesla: the new Uber?,,"Shares in electric car maker Tesla continue to climb after Morgan Stanley predicted its stock will nearly double in the next 12 months. But as Ivor Bennett reports, the sector still faces plenty of challenges.",2015-08-18 16:11:40+00:00,[]
28,"Trying to Win the Public’s Trust With Autonomous Cars, at 120 M.P.H.",Wheels,"SONOMA, Calif. — Markus Hoffmann, an engineer at Audi, prepared himself for a high-speed run around the Sonoma Raceway here in Northern California.",2015-07-16 21:38:03+00:00,"['Driverless and Semiautonomous Vehicles', 'Audi Division of Volkswagen AG', 'Automobiles', 'California', 'Google Inc', 'Tesla Motors Inc', 'Cadillac Division of General Motors Corp']"
29,Lurching Start for Tesla in China,,"BEIJING — For $104,000, Yu Hangmei expected a car that could, at the very least, be driven. What Ms. Yu said she got instead was a new electric Tesla Model S sedan and a malfunctioning charging station.",2015-02-10 18:01:19+00:00,"['Tesla Motors Inc', 'China', 'Electric and Hybrid Vehicles']"
